name	url	latest_ver	latest_release	author	visidata_ver	description	requirements
vfake	https://raw.githubusercontent.com/saulpw/visidata/develop/plugins/vfake.py	0.9	2019-02-08	Saul Pwanson <vd@saul.pw>	2.-1	replace column with fake values	Faker
vddedupe	https://raw.githubusercontent.com/jsvine/visidata-plugins/master/plugins/vddedupe.py	0.0.1	2019-01-01	Jeremy Singer-Vine @jsvine	1.5.2	adds commands for selection and removal of rows which are duplicates of prior rows	
vdnormcol	https://raw.githubusercontent.com/jsvine/visidata-plugins/master/plugins/vdnormcol.py	0.0.0	2018-12-31	Jeremy Singer-Vine @jsvine	1.5.2	normalises column names in any given sheet so that the names are unique, valid Python identifiers, and only composed of lowercase letters, numbers, and underscores	
vdfec	https://raw.githubusercontent.com/jsvine/visidata-plugins/master/plugins/vdfec.py	0.0.0	2019-04-21	Jeremy Singer-Vine @jsvine	1.5.2	loader for .fec files from the Federal Election Commission	fecfile
livesearch	https://raw.githubusercontent.com/saulpw/visidata/develop/plugins/livesearch.py	0.9	2019-06-09	Saul Pwanson <vd@saul.pw>	2.-1	filter rows as you search	
sparkline	https://raw.githubusercontent.com/saulpw/visidata/develop/plugins/sparkline.py	0.1	2019-07-02	Lucas Messenger @layertwo	2.-1	add a sparkline column to visualise trends of numeric cells in a row	
rownum	https://raw.githubusercontent.com/saulpw/visidata/develop/plugins/rownum.py	0.9	2019-04-30	Saul Pwanson <vd@saul.pw>	2.-1	add column of original row ordering	
vdtabulate	https://raw.githubusercontent.com/jsvine/visidata-plugins/master/plugins/vdtabulate.py	0.0.0	2019-04-28	Jeremy Singer-Vine @jsvine	1.5.2	save sheet as text-tables	tabulate
